{"$schema":"https://json-schema.org/draft/2020-12/schema","type":"object","properties":{"version":{"const":2},"codec_id":{"const":"jimu.history.policy.refs.v2"},"schema_sha256":{"type":"string","pattern":"^[a-f0-9]{64}$"},"policy_sha256":{"const":"8f1637c630973253968efee96cbf8640de5f12c836ad8a1e2bfc86d34134f3d9"},"catalog_digest":{"const":"c5e41af8f9ff746ade078feaecd5fdad245188829c65e595dc4c0c49dc846a29"}},"required":["version","codec_id","schema_sha256","policy_sha256","catalog_digest"],"additionalProperties":false}