{"version":2,"codec_id":"jimu.history.policy.refs.v2","schema_sha256":"c10de69d7152ee2c929380fdc3763bd878748973ae396ebccce6e80473cf7c6e","policy_sha256":"8f1637c630973253968efee96cbf8640de5f12c836ad8a1e2bfc86d34134f3d9","catalog_digest":"c5e41af8f9ff746ade078feaecd5fdad245188829c65e595dc4c0c49dc846a29"}